{
  "recording_id": "rec_01J00000000000000000000000",
  "tenant_id": "ten_01J00000000000000000000000",
  "conversation_id": "conv_01J00000000000000000000000",
  "work_order_id": "wrk_01J00000000000000000000000",
  "sandbox_id": "sbx_01J00000000000000000000000",
  "runtime_session_id": "rts_01J00000000000000000000000",
  "status": "ready",
  "channels": [
    "terminal"
  ],
  "recording_policy_digest": "sha256:a1a1a1a1a1a1a1a1a1a1a1a1a1a1a1a1a1a1a1a1a1a1a1a1a1a1a1a1a1a1a1a1",
  "classification": "internal",
  "retention_until": "2026-08-14T10:30:00Z",
  "chunk_count": 1,
  "manifest_digest": "sha256:ee0b1d3eb968c432ce6c609d65972389a619c04c4e82bd7283e33077144d2aa6",
  "created_at": "2026-07-15T10:00:00Z",
  "updated_at": "2026-07-15T10:30:00Z",
  "completed_at": "2026-07-15T10:30:00Z"
}
